{
  "schema": "phynd-firstmate-m1-task-graph.v1",
  "title": "Phynd Firstmate Local Software Factory \u2014 Milestone 1",
  "generated": "2026-08-28",
  "task_count": 121,
  "epics": [
    {
      "id": "E0",
      "title": "Prompt architecture and quality baseline",
      "goal": "Fix the verbosity failure before asking the factory to design or implement anything else.",
      "phase": "Foundation",
      "tasks": [
        [
          "E0.01",
          "Inventory every prompt surface",
          "Document the current Pi system prompt files, AGENTS/CLAUDE context, communication-discipline skill, role prompts, setup-time prompt copies, and child-harness prompt injection.",
          "Prompt inventory with owner, scope, precedence, and hash.",
          "No prompt source or injection path remains implicit.",
          [],
          "Luna xhigh + Python"
        ],
        [
          "E0.02",
          "Create the prompt evaluation corpus",
          "Build representative prompts for compact chat, detailed technical design, implementation plan, task graph, PR review, incident response, setup diagnosis, and Lavish artifact delivery.",
          "Versioned fixtures under tests/fixtures/prompt-policy.",
          "Every output mode and high-risk failure is represented.",
          [
            "E0.01"
          ],
          "Python"
        ],
        [
          "E0.03",
          "Build a repeatable prompt evaluation runner",
          "Launch isolated Pi/Luna xhigh sessions against current and candidate prompts; capture tool calls, output artifacts, token counts, and required-section coverage.",
          "Python eval CLI with JSON results.",
          "The same fixture can compare prompt versions without hand scoring.",
          [
            "E0.02"
          ],
          "Python"
        ],
        [
          "E0.04",
          "Define output-mode schema",
          "Add CHAT, ARTIFACT, BRIEF, REVIEW, and INCIDENT modes with explicit completeness and presentation requirements.",
          "phynd.output-contract.v1 JSON schema.",
          "Every task has one resolved output contract before dispatch.",
          [
            "E0.01"
          ],
          "Python"
        ],
        [
          "E0.05",
          "Write the scoped Firstmate driver prompt",
          "Replace the global concision wording with a small mode-aware driver contract: concise chat, complete artifacts, complete briefs, evidence-first reviews, mandatory Lavish artifact gate.",
          "defaults/phynd-driver-append-system.md.",
          "The prompt contains no arbitrary output-length target and explicitly exempts artifacts, specs, code, tests, and evidence from concision.",
          [
            "E0.04"
          ],
          "Luna xhigh"
        ],
        [
          "E0.06",
          "Refactor communication-discipline",
          "Limit brevity rules to chat and progress. Replace the blanket ban on implementation tours with a rule that requested implementation detail belongs in the artifact, not chat.",
          "Updated communication-discipline skill.",
          "A requested design or task list cannot be shortened by this skill.",
          [
            "E0.04",
            "E0.05"
          ],
          "Luna xhigh"
        ],
        [
          "E0.07",
          "Add role-specific worker prompt capsules",
          "Create minimal prompts for design author, adversarial reviewer, implementer, PR self-reviewer, incident investigator, and route scout.",
          "Versioned role prompt files.",
          "Children receive only role-relevant constraints; the driver prompt is not sprayed globally.",
          [
            "E0.05"
          ],
          "Luna xhigh"
        ],
        [
          "E0.08",
          "Scope Pi prompt injection to the Firstmate code root",
          "Install the driver contract as project-local .pi/APPEND_SYSTEM.md rather than a global prompt that affects unrelated projects.",
          "Managed project-local prompt installation.",
          "A Pi worker in another repository does not inherit the Firstmate driver presentation policy.",
          [
            "E0.05"
          ],
          "Python"
        ],
        [
          "E0.09",
          "Remove unscoped Claude concision injection",
          "Stop treating ~/.claude/phynd-concise.md as a universal launch prompt. Claude workers receive an explicit role prompt through their launch profile.",
          "Setup migration and compatibility warning.",
          "Existing user-owned files are never deleted; stale Firstmate-managed copies are detected and retired safely.",
          [
            "E0.07"
          ],
          "Python"
        ],
        [
          "E0.10",
          "Report active prompt provenance at session start",
          "Expose driver prompt version/hash, output-mode policy version, and role-prompt version in the startup digest.",
          "Prompt provenance block.",
          "The captain can prove which prompt governed the session.",
          [
            "E0.08"
          ],
          "Python"
        ],
        [
          "E0.11",
          "Run current-versus-candidate A/B evaluation",
          "Measure chat compactness, artifact completeness, required-section recall, Lavish invocation, unsupported claims, and decision surfacing.",
          "Evaluation report in Lavish.",
          "Candidate preserves or improves chat signal while achieving 100% required artifact coverage on golden fixtures.",
          [
            "E0.03",
            "E0.05",
            "E0.06",
            "E0.08"
          ],
          "Luna xhigh + Python"
        ],
        [
          "E0.12",
          "Human-approve the prompt policy",
          "Present the A/B report and exact prompt in Lavish with Approve, Revise, and Reject controls.",
          "Prompt approval receipt bound to prompt hash.",
          "No later milestone uses the new prompt until explicit approval.",
          [
            "E0.11"
          ],
          "Lavish + human"
        ]
      ]
    },
    {
      "id": "E1",
      "title": "Mandatory Lavish artifact execution",
      "goal": "Make rich human review a hard workflow for artifact-class deliverables instead of a model preference.",
      "phase": "Foundation",
      "tasks": [
        [
          "E1.01",
          "Add phynd-lavish-delivery skill",
          "Create the single owner for Lavish help/design/playbook discovery, artifact authoring, open, poll, feedback, revision, acceptance, and retirement.",
          "Internal skill with narrow AGENTS trigger.",
          "The full workflow is stated once and loaded whenever lavish_required=true.",
          [
            "E0.12"
          ],
          "Luna xhigh"
        ],
        [
          "E1.02",
          "Define artifact-class detection",
          "Resolve plan, design, comparison, diagram, table-heavy report, roadmap, HTML artifact, and structured human decision into lavish_required=true.",
          "Deterministic deliverable classifier.",
          "The model cannot silently choose prose for a required artifact.",
          [
            "E0.04"
          ],
          "Python"
        ],
        [
          "E1.03",
          "Add Lavish requirement to task envelopes",
          "Carry artifact type, lavish_required, human_review_required, and acceptance key from intake through brief, spawn, task state, and completion.",
          "Schema and lifecycle changes.",
          "Missing required fields fail before spawn.",
          [
            "E1.02"
          ],
          "Python"
        ],
        [
          "E1.04",
          "Resolve current Lavish guidance before authoring",
          "Execute lavish-axi --help, lavish-axi design, and every matching playbook before writing the first HTML revision.",
          "Guidance receipt with CLI version and playbook IDs.",
          "An artifact cannot claim the Lavish path if guidance was skipped.",
          [
            "E1.01",
            "E1.03"
          ],
          "Worker + Lavish"
        ],
        [
          "E1.05",
          "Create the Phynd artifact shell",
          "Provide a responsive, offline-first HTML shell with print support, stable annotation targets, diagrams, tables, decisions, task export, and strong mobile behavior.",
          "Reusable artifact template.",
          "Pass light, dark, narrow, print, and no-network rendering checks.",
          [
            "E1.04"
          ],
          "Fable high + Lavish"
        ],
        [
          "E1.06",
          "Open artifacts through Lavish",
          "Use the CLI against the canonical HTML path and record the session identity.",
          "Artifact-open receipt.",
          "No artifact is presented as reviewable until Lavish confirms the session.",
          [
            "E1.05"
          ],
          "Lavish"
        ],
        [
          "E1.07",
          "Arm durable Lavish feedback",
          "Register the existing fm-procevent-lavish adapter and bind feedback to the task and owning worker.",
          "Durable feedback source.",
          "A restart after arm can still route captured feedback to the correct task.",
          [
            "E1.06"
          ],
          "Python + existing adapter"
        ],
        [
          "E1.08",
          "Keep the artifact owner alive",
          "Prevent teardown while a Lavish review remains open; route every feedback batch to the same worker unless recovery proves replacement is necessary.",
          "Artifact-owner lifecycle rule.",
          "Context is preserved across iterative design feedback.",
          [
            "E1.07"
          ],
          "Firstmate driver"
        ],
        [
          "E1.09",
          "Add explicit artifact decisions",
          "Embed Approve, Revise, and Stop controls using Lavish structured input. An empty close is not approval.",
          "Keyed human decision contract.",